content,date,ticket,title
"([""It doesn't matter your age or experience: taking full advantage of the stock market and investing with confidence are common goals for all investors."", 'Many investors also have a go-to methodology that helps guide their buy and sell decisions. One way to find winning stocks based on your preferred way of investing is to use the Zacks Style Scores, which are indicators that rate stocks based on three widely-followed investing types: value, growth, and momentum.', ""Different than value or momentum investors, growth-oriented investors are concerned with a stock's future prospects, and the overall financial health and strength of a company. Thus, they'll want to focus on the Growth Style Score, which analyzes characteristics like projected and historical earnings, sales, and cash flow to find stocks that will see sustainable growth over time."", 'Headquartered in Richmond, VA, Kinsale Capital was established in 2009. It offers various insurance and reinsurance productsacross all 50 states of the United States, the District of Columbia, the Commonwealth of Puerto Rico and the U.S. Virgin Islands. It operates primarily through two markets – Commercial and Personal. While personal lines include homeowners insurance; commercial lines offerings cover construction, small business, excess casualty, commercial property, product\xa0\xa0 liability, allied health, general casualty, management liability, inland marine, commercial insurance and public entity.', 'KNSL sits at a Zacks Rank #3 (Hold), holds a Growth Style Score of B, and has a VGM Score of B. Earnings and sales are forecasted to increase 10.1% and 10.3% year-over-year, respectively.', 'Four analysts revised their earnings estimate upwards in the last 60 days for fiscal 2025. The Zacks Consensus Estimate has increased $0.36 to $17.68 per share. KNSL boasts an average earnings surprise of 11.1%.', 'On a historic basis, Kinsale Capital Group, Inc. has generated cash flow growth of 47.8%, and is expected to report cash flow expansion of 29.2% this year.', ""With solid fundamentals, a good Zacks Rank, and top-tier Growth and VGM Style Scores, KNSL should be on investors' short lists."", 'Want the latest recommendations from Zacks Investment Research? Today, you can download 7 Best Stocks for the Next 30 Days. '],)","(['Zacks ', ' 8 hours ago'],)","(['KNSL '],)",Why This 1 Growth Stock Could Be a Great Addition to Your Portfolio
"(['(Bloomberg) -- Investors betting against Palantir Technologies Inc. are throwing in the towel as the software maker’s shares keep pushing higher, aided by fervent retail traders and heightened geopolitical tensions.', 'Most Read from Bloomberg', 'Short interest in Palantir as a percentage of shares available to trade is about 2%, down from a high of 5% in October, according to data from S3 Partners. The stock has rallied nearly 300% over that span, handing short sellers paper losses of roughly $7 billion. Shares extended that gain in early trading Thursday, rising as much as 3.7%, on track for a record close.', 'Palantir, which makes software used by governments and corporations to analyze large volumes of data, is the best-performing stock in the S&P 500 this year amid excitement about its artificial intelligence products and signs that it’s winning more business from the Trump administration. Palantir is also the most expensive stock in the benchmark, however, with a price to estimated sales ratio of 76 times. Nvidia Corp., by contrast, is priced at 17 times.', 'The momentum behind Palantir, which helped send shares to a fresh intraday record on Wednesday, has made it dangerous to bet against, even though the valuation is difficult to justify, said Thomas George, president at Grizzle Investment Management.', '“The frenzy can go on for longer than the bears or shorts would like, and we’ve seen too many people get their fingers chopped off trying to short something,” George said. “It really feels like the stock is trading on vibes.”', 'While Palantir stands out on Wall Street for both its lofty multiple and the size of its rally, the stock has proven remarkably resilient, frustrating those betting on a reversal. Some have even likened it to a meme stock, given the heavy interest from retail investors who think demand for AI software will keep Palantir’s revenue expanding at a rapid clip.', 'Palantir’s work with government and military customers has been in particular focus in recent sessions as US strikes on nuclear facilities in Iran over the weekend raised the specter of a broader conflict in the Middle East. President Donald Trump announced a surprise ceasefire agreement between Israel and Iran following more than a week of drone and missile attacks between the countries.', '“Palantir is in the right area code for the future of defense tech, so the market could view a fair tailwind from the events over the weekend,” George said. It “is clearly a beneficiary of heightened geopolitical tensions, but even heightened geopolitical tensions don’t justify Palantir’s valuation.”', 'The Denver-based company is expected to see sales jump 36% this year, followed by an expansion of 29% in 2026, according to the average of analyst estimates compiled by Bloomberg. That places Palantir among the fastest growing companies in the Nasdaq 100.', 'Valuation is the key sticking point on Wall Street. Fewer than a third of the analysts tracked by Bloomberg recommend buying the stock, an unusually low rate among companies with market capitalizations in excess of $300 billion. Based on the average price target, analysts see downside of 25% over the coming year, the weakest implied return in the Nasdaq 100 Index.', 'The institutional hesitancy has been overshadowed by heavy interest from individual investors. In terms of client orders, Palantir is consistently one of the most active securities on Interactive Brokers’ platform, according to the firm’s data. Vanda Research, which analyzes retail trading, ranks Palantir as the third-highest stock by net retail purchases, behind Tesla Inc. and Nvidia Corp., which are both substantially larger.', '“Palantir trades at a ridiculous multiple, but welcome to the world of AI stocks,” said Louis Navellier, chief executive officer of Navellier & Associates, who owns the stock.', '“The stock should be safe in the near term, since there’s certainly a need for cost-efficient intel and I don’t think the AI party will end soon,” he said. “Still, while the short sellers have gotten pretty quiet, the multiple means they’ll come back. They always do.”', 'Tech Chart of the Day', 'Nvidia Corp. shares rose to an all-time high on Wednesday, with the leader in artificial intelligence chips extending an advance that has cemented its position as one of the most valuable companies in the world.', 'Top Tech News', 'Micron Technology Inc., Wall Street’s favorite chipmaker this year, delivered an outlook that wasn’t quite rosy enough to keep its 2025 rally going.', 'After a chastening crackdown that wiped billions off their value and forced top executives out of the public eye, China’s technology giants are back in favor and on the front foot, making deals and snapping up assets.', 'The unveiling of Xiaomi Corp.’s first electric SUV on Thursday will showcase how the Chinese tech company has become an investor darling with its high-stakes bet on the auto market.', 'Reconova Technologies Co., a Chinese artificial intelligence company specializing in visual perception, is planning a Hong Kong initial public offering as soon as this year, according to people familiar with the matter.', 'Earnings Due Thursday', 'No major earnings expected', '--With assistance from Carmen Reinicke.', '(Adds stock move after market open in second paragraph)', 'Most Read from Bloomberg Businessweek', '©2025 Bloomberg L.P.'],)","(['Bloomberg ', ' 7 hours ago'],)","(['NVDA ', 'TSLA '],)",Palantir Short Sellers Bail as Top S&P 500 Stock Keeps Climbing
"(['Shares of ', ' (ASC) have gained 6.4% over the past four weeks to close the last trading session at $10.08, but there could still be a solid upside left in the stock if short-term price targets of Wall Street analysts are any indication. Going by the price targets, the mean estimate of $13.17 indicates a potential upside of 30.7%.', 'The average comprises three short-term price targets ranging from a low of $12.50 to a high of $14.00, with a standard deviation of $0.76. While the lowest estimate indicates an increase of 24% from the current price level, the most optimistic estimate points to a 38.9% upside. More than the range, one should note the standard deviation here, as it helps understand the variability of the estimates. The smaller the standard deviation, the greater the agreement among analysts.', 'While the consensus price target is highly sought after by investors, the ability and unbiasedness of analysts in setting price targets have long been questionable. And investors making investment decisions solely based on this tool would arguably do themselves a disservice.', ""But, for ASC, an impressive average price target is not the only indicator of a potential upside. Strong agreement among analysts about the company's ability to report better earnings than they predicted earlier strengthens this view. While a positive trend in earnings estimate revisions doesn't gauge how much a stock could gain, it has proven to be powerful in predicting an upside."", 'According to researchers at several universities across the globe, a price target is one of many pieces of information about a stock that misleads investors far more often than it guides. In fact, empirical research shows that price targets set by several analysts, irrespective of the extent of agreement, rarely indicate where the price of a stock could actually be heading.', ""While Wall Street analysts have deep knowledge of a company's fundamentals and the sensitivity of its business to economic and industry issues, many of them tend to set overly optimistic price targets. Are you wondering why?"", 'They usually do that to drum up interest in shares of companies that their firms either have existing business relationships with or are looking to be associated with. In other words, business incentives of firms covering a stock often result in inflated price targets set by analysts.', ""However, a tight clustering of price targets, which is represented by a low standard deviation, indicates that analysts have a high degree of agreement about the direction and magnitude of a stock's price movement. While that doesn't necessarily mean the stock will hit the average price target, it could be a good starting point for further research aimed at identifying the potential fundamental driving forces."", 'That said, while investors should not entirely ignore price targets, making an investment decision solely based on them could lead to disappointing ROI. So, price targets should always be treated with a high degree of skepticism.', ""There has been increasing optimism among analysts lately about the company's earnings prospects, as indicated by strong agreement among them in revising EPS estimates higher. And that could be a legitimate reason to expect an upside in the stock. After all, empirical research shows a strong correlation between trends in earnings estimate revisions and near-term stock price movements."", 'For the current year, one estimate has moved higher over the last 30 days compared to no negative revision. As a result, the Zacks Consensus Estimate has increased 16.2%.', ""Moreover, ASC currently has a Zacks Rank #1 (Strong Buy), which means it is in the top 5% of more than 4,000 stocks that we rank based on four factors related to earnings estimates. Given an impressive externally-audited track record, this is a more conclusive indication of the stock's potential upside in the near term. You can see the complete list of today's Zacks Rank #1 (Strong Buy) stocks here >>>> ."", 'Therefore, while the consensus price target may not be a reliable indicator of how much ASC could gain, the direction of price movement it implies does appear to be a good guide.', 'Want the latest recommendations from Zacks Investment Research? Today, you can download 7 Best Stocks for the Next 30 Days. '],)","(['Zacks ', ' 7 hours ago'],)","(['ASC '],)",Wall Street Analysts Think Ardmore Shipping (ASC) Could Surge 30.65%: Read This Before Placing a Bet
"(['ETR focuses on consistent investments in infrastructure upgrades to better serve its customers. The company is also steadily expanding its renewable generation portfolio. Given its strong growth, ETR makes for a solid investment option in the Zacks Utility Electric Power industry.', 'Let’s focus on the reasons that make this Zacks Rank #2 (Buy) stock a robust investment pick at the moment.', 'The Zacks Consensus Estimate for ETR’s 2026 earnings per share (EPS) has increased 0.7% to $4.35 in the past 60 days.\xa0', 'The Zacks Consensus Estimate for 2025 sales is pegged at $12.54 billion, indicating year-over-year growth of 5.6%.', 'ETR’s long-term (three to five years) earnings growth rate is 9.5%. The company surpassed expectations in the last four reported quarters and delivered an average earnings surprise of 12.06%.', 'Return on equity (ROE) indicates how efficiently a company has been utilizing its funds to generate higher returns. Currently, Entergy’s ROE is 11.43% compared to its industry’s average of 10.09%. This indicates that the company has been utilizing its funds more constructively than its peers in the industry.', 'Entergy’s times interest earned ratio (TIE) at the end of the first quarter of 2025 was 2.4. The TIE ratio greater than 1 suggests that the company will be able to make its interest payment obligations in the near term without difficulty.', 'Entergy has a defined capital investment strategy with the goal of modernizing, decarbonizing and diversifying its portfolio. The company intends to invest $37 billion between 2025 and 2028, mostly to upgrade its distribution, generation and transmission while supporting renewable expansion.\xa0', 'Entergy has also made considerable investments in grid hardening to make its transmission and distribution networks more resilient, resulting in improved customer service. During the first quarter of 2025, the company spent $144 million on distribution construction to improve the reliability of its distribution system.', ""Entergy has been increasing shareholders’ value through solid dividend payments. Currently, the company’s quarterly dividend is 60 cents per share, resulting in an annualized dividend of $2.40. The company’s current dividend yield is 2.95%, better than the Zacks S&P 500 Composite's average of 1.22%."", 'In the past year, ETR shares have risen 52.3% compared with the industry’s growth of 16.6%.', 'A few other top-ranked stocks from the same industry are ', ' FTS, ', ' NI and ', ' POR, each holding a Zacks Rank #2 at present. You can see ', '.', 'FTS’ long-term earnings growth rate is 5%. The Zacks Consensus Estimate for its 2025 EPS stands at $2.47, which indicates a year-over-year jump of 3.4%.', 'NI’s long-term earnings growth rate is 7.9%. The Zacks Consensus Estimate for 2025 EPS is pegged at $1.88, which suggests a year-over-year rise of 7.4%.', 'POR’s long-term earnings growth rate is 3.4%. The Zacks Consensus Estimate for 2025 EPS is pegged at $3.21, which calls for a year-over-year improvement of 2.2%.', 'Want the latest recommendations from Zacks Investment Research? Today, you can download 7 Best Stocks for the Next 30 Days. '],)","(['Zacks ', ' 7 hours ago'],)","(['ETR ', 'FORFF '],)",Why Entergy Stock Deserves a Spot in Your Portfolio Right Now
"(['Taking full advantage of the stock market and investing with confidence are common goals for new and old investors alike.', 'Achieving those goals is made easier with the Zacks Style Scores, a unique set of guidelines that rates stocks based on popular investing methodologies, namely value, growth, and momentum. The Style Scores can help you narrow down which stocks are better for your portfolio and which ones can beat the market over the long-term.', 'Momentum investors, who live by the saying ""the trend is your friend,"" are most interested in taking advantage of upward or downward trends in a stock\'s price or earnings outlook. Utilizing one-week price change and the monthly percentage change in earnings estimates, among other factors, the Momentum Style Score can help determine favorable times to buy high-momentum stocks.', ""Based in Venlo, the Netherlands, QIAGEN N.V. is one of the world's leading providers of technologies and products for the separation, purification and handling of nucleic acids DNA/RNA. The company provides innovative technologies and products for pre-analytical sample preparation and molecular diagnostics solutions. It has developed a comprehensive portfolio of over 500 proprietary, consumable products, and automated solutions for sample collection."", ""QGEN boasts a Momentum Style Score of B and VGM Score of B, and holds a Zacks Rank #2 (Buy) rating. Shares of Qiagen has seen some interesting price action recently; the stock is up 1.9% over the past one week and up 6.9% over the past four weeks. And in the last one-year period, QGEN has gained 13.3%. As for the stock's trading volume, 1,369,402 shares on average were traded over the last 20 days."", ""Momentum investors don't just pay attention to price changes; positive earnings play a crucial role, too. Nine analysts revised their earnings estimate upwards in the last 60 days for fiscal 2025. The Zacks Consensus Estimate has increased $0.07 to $2.34 per share. QGEN boasts an average earnings surprise of 4.9%."", 'Investors should take the time to consider QGEN for their portfolios due to its solid Zacks Ranks, notable earnings metrics, and impressive Momentum and VGM Style Scores.', 'Want the latest recommendations from Zacks Investment Research? Today, you can download 7 Best Stocks for the Next 30 Days. '],)","(['Zacks ', ' 7 hours ago'],)","(['QGEN '],)",Why This 1 Momentum Stock Could Be a Great Addition to Your Portfolio
"([""It doesn't matter your age or experience: taking full advantage of the stock market and investing with confidence are common goals for all investors."", 'Achieving those goals is made easier with the Zacks Style Scores, a unique set of guidelines that rates stocks based on popular investing methodologies, namely value, growth, and momentum. The Style Scores can help you narrow down which stocks are better for your portfolio and which ones can beat the market over the long-term.', ""For momentum investors, upward or downward trends in a stock's price or earnings outlook take precedent, so they'll want to zero in on the Momentum Style Score. This Score can pinpoint good times to build a position in a stock, using factors like one-week price change and the monthly percentage change in earnings estimates."", 'Headquartered at Philadelphia, PA, Crown Holdings is a leading global manufacturer of packaging products for consumer goods. Crown makes a wide variety of steel and aluminum cans for food, beverage, household, and other consumer products and metal vacuum closures, steel crowns and caps.', 'CCK is a Zacks Rank #1 (Strong Buy) stock, with a Momentum Style Score of A and VGM Score of B. Shares are up 1.4% over the past one week and up 6.2% over the past four weeks. CCK has gained 34.2% in the last one-year period as well. Looking at trading volume, an average of 1,124,268 shares exchanged hands over the last 20 trading days.', ""Momentum investors also pay close attention to a company's earnings. For CCK, five analysts revised their earnings estimate upwards in the last 60 days, and the Zacks Consensus Estimate has increased $0.35 to $7.1 per share for 2025. CCK boasts an average earnings surprise of 16.3%."", ""CCK should be on investors' short list because of its impressive earnings fundamentals, a good Zacks Rank, and strong Momentum and VGM Style Scores."", 'Want the latest recommendations from Zacks Investment Research? Today, you can download 7 Best Stocks for the Next 30 Days. '],)","(['Zacks ', ' 7 hours ago'],)","(['CCK '],)",Why This 1 Momentum Stock Could Be a Great Addition to Your Portfolio
"([' ICE hit a 52-week high of $181.65 on June 25. Shares closed at $180.53 after gaining 21.2% year to date, outperforming the industry, the sector and the Zacks S&P 500 composite in the same time frame.', 'Intercontinental has outperformed its peers, including ', 'CBOE, ', 'CME and ', 'NDAQ. Shares of CBOE, CME and NDAQ have gained 17.9%, 17.6% and 13.9%, respectively, year to date.', 'With a market capitalization of $103.55 billion, the average number of shares traded in the last three months was 3.2 million.', 'Shares of Intercontinental are trading above the 50-day and 200-day simple moving averages (SMA) of $173.34 and $164.01, respectively, indicating solid upward momentum. SMA is a widely used technical analysis tool to predict future price trends by analyzing historical price data.', 'Intercontinental shares are trading at a forward price-to-earnings of 24.72X, lower than the industry average of 26.25X. Its pricing, at a discount to the industry average, gives a better entry point to investors.', 'The Zacks Consensus Estimate for Intercontinental Exchange’s 2025 earnings per share indicates a year-over-year increase of 14.5%. The consensus estimate for revenues is pegged at $9.96 billion, implying a year-over-year improvement of 7.3%.\xa0', 'The consensus estimate for 2026 earnings per share and revenues indicates an increase of 10.4% and 5.7%, respectively, from the corresponding 2025 estimates.\xa0', 'The expected long-term earnings growth rate is 13.3%, outperforming the industry average of 10.1%.', 'Seven of the nine analysts covering the stock have raised estimates for 2025, while seven of the 10 analysts have raised the same for 2026 over the past 60 days. Thus, the Zacks Consensus Estimate for 2025 and 2026 moved 1.3% and 1.2% north, respectively, in the last 60 days.', 'Based on short-term price targets offered by 17 analysts, the Zacks average price target is $194.18 per share. The average suggests a potential 7.3% upside from the last closing price.', 'Intercontinental surpassed earnings estimates in three of the last four quarters and matched in one, the average being 1.30%.', 'ICE’s top line is poised to improve on strength in global data services and index business, growth in pricing and reference data business, and strength in ICE Global Network offering, solid desktop, feeds and derivatives analytics. The company has been achieving expense synergies from strategic acquisitions, which have also strengthened its portfolio and expanded its presence.', 'ICE boasts the largest mortgage network across the United States and thus remains well-positioned to benefit from accelerated digitization in the residential mortgage industry.', 'ICE continuously engages in strategic investments supported by a healthy and minimal risk-based balance sheet, which also offers stability and buoyancy over the medium to long term.', 'However, operating expenses have been increasing over the last several years, weighing on margin expansion. With continuous growth initiatives like product launches and technology upgrades, we believe that expenses are likely to remain elevated in the near term.', 'Though the debt balance declined, its leverage as well as times interest earned compares unfavorably with the industry average.', 'ICE is poised for growth, banking on the strength of its compelling portfolio and expansive risk-management services, which also ensure revenue flow, as well as strategic buyouts, a solid balance sheet and effective capital deployment. Its dividend history is impressive. It has more than doubled its dividends in the last six years.', 'Optimistic analyst sentiment, favorable growth estimates, as well as attractive valuations, should continue to benefit ICE over the long term.', 'It is, therefore, wise to hold on to this Zacks Rank #3 (Hold) stock at present. You can see the complete list of today’s Zacks #1 Rank (Strong Buy) stocks here.', 'Want the latest recommendations from Zacks Investment Research? Today, you can download 7 Best Stocks for the Next 30 Days. '],)","(['Zacks ', ' 7 hours ago'],)","(['CBOE ', 'CME '],)","ICE Hits 52-Week High, Trades at a Discount: How to Play the Stock"
