content,date,ticket,title
"(Bloomberg) -- Roaring returns for US IPOs are driving fresh optimism that activity will pick up steam later this year and into 2026, even as worries over geopolitics and President Donald Trump’s tariffs hang over the market.Most Read from BloombergLed by triple-digit-percent increases for Circle Internet Group Inc. and CoreWeave Inc. — two of the year’s five largest initial public offerings on US exchanges — this year’s class of debutantes are trading up by a weighted average of about 53%, data compiled by Bloomberg show. That’s left investors hungry for more, particularly in a year where the S&P 500 Index has struggled to remain in the black.“We’ve been positively surprised by the way the market has handled the tariff headlines, and how investors have thought about that potential risk factor,” according to Keith Canton, JPMorgan Chase & Co.’s co-head of Americas equity capital markets.That resilience could draw out some of the companies that had been planning to go before Trump’s tariffs briefly derailed activity. The US IPO calendar into summer is sparse, but the second half of 2025 has more promise.A handful of $1 billion-plus IPOs are likely before the end of the year, most of which will come after Labor Day, said Canton.Volume MirageAt nearly the half-way mark of the year, IPOs on US exchanges have raised $29.1 billion, surging 45% versus the same period last year, according to data compiled by Bloomberg.That’s not nearly as good as it sounds.Proceeds from IPOs are actually down from last year, when you excise the $12.1 billion of blank-check vehicle listings — an increase of more than 400% from last year. While special purpose acquisition companies have raised a lot of money in listings, some of the underwriters’ fees are deferred until the blank-check merges with a private firm and takes it public. That activity remains depressed compared to the heady levels of 2021.Excluding SPACs and tiny listings by companies raising less than $50 million, only 33 IPOs have priced this year, down from 41 in the first half of 2024.April, typically a strong month, saw only two sizable debuts, with the Trump administration’s so-called Liberation Day tariff announcement putting dozens of deals on hold.With those tensions having retreated to the background, blockbuster debuts such as stablecoin issuer Circle’s are working to restore the reputation of IPOs for fast share-price appreciation, and wealth creation.Thematically, financial technology and crypto-related companies may continue to figure heavily in the deal mix, and many investors await the return of software and biotech, sectors that historically saw plenty of activity.Private tech companies that have been on many IPO wishlists still have no shortage of alternatives to going public. ChatGPT developer OpenAI raised $40 billion from a private funding round, the latest record-setting demonstration of the depth of capital available. Still, bankers say even that has its limits.“At some point these companies want liquidity on a larger scale than private markets provide, even in an environment in which a $40 billion round is possible,” said Heath Terry, Citigroup Inc.’s global head of technology and communications research. “We will see that eventually.”Understanding Over ValuationsThe lack of near-term listings speaks to a perennial debate over whether investors and pre-IPO companies are reaching an understanding over valuations.A combination of investors’ painful memories from overpaying for IPOs in the go-go days of 2021, and asset owners’ unwillingness to go public at valuations significantly below that era’s peak, has left many companies stuck in the pipeline for the past three and a half years.The logjam may be easing. IPOs — which can include the company raising new money, backers selling existing shares, or both — have recently featured more shares offered by existing investors, known as secondary shares. These help to limit the dilution that would result from the company selling new shares at a lower valuation than the nosebleed levels achieved in previous funding rounds.“Since mid-May, we have seen greater secondary participation in IPOs, despite wider IPO discounts versus what we have seen historically,” said Jim Cooney, head of Americas ECM at Bank of America Corp.All that aside, concerns around geopolitical tensions haven’t gone away, and the Federal Reserve is keeping interest rates higher than many investors — and the White House — would like. Bankers are required to balance their optimism with pragmatism, according to Clay Hale, Wells Fargo & Co.’s co-head of ECM.“The optimistic side tells you markets are trading well today, there are a lot of high-quality companies that have a desire to be in the public markets, and investors are making a decent return from IPOs,” said Hale.“The pragmatic part is that there are a lot of things going on that can grab investors’ attention, whether it be taxes, tariffs or geopolitics, which create a need to be more thoughtful.”Most Read from Bloomberg Businessweek©2025 Bloomberg L.P.","(['Bloomberg ', ' 8 hours ago'],)","(['CRCL ', 'CRWV '],)",US IPO Stocks Jump Over 50% in 2025 as Investor Appetite for Risk Grows
"BAC and  WFC are two of the U.S. Big Four banks and are designated systemically important financial institutions. Both generate substantial net interest income (NII) and have deep exposure to consumer banking, making them sensitive to interest rate trends and broader economic conditions. While they share similar macroeconomic drivers, WFC has regained strategic flexibility following the lifting of its asset cap, whereas BAC continues to leverage momentum in its investment banking (IB) operations. Let us delve deeper and assess the long-term growth prospects of each bank to determine which currently presents the stronger investment opportunity.Bank of America, one of the most rate-sensitive banks in the country, is prioritizing organic, domestic growth through the expansion of its physical and digital presence. This is part of a broader strategy to solidify customer relationships and tap into new markets, driving NII growth over time. By 2027, the company plans to expand its financial center network and open more than 150 centers. It sees an upside to NII in 2025, with the metric expected to rise 6-7%.Coupled with the growing adoption of digital tools such as the Zelle money transfer system and the AI-powered assistant Erica, these initiatives support BAC's ability to enhance digital engagement and cross-sell a range of products, including mortgages, auto loans and credit cards.Also, BAC’s IB business is poised to rebound once macroeconomic and geopolitical uncertainties ease. During the first quarter of 2025, the company recorded decent IB performance despite a challenging operating environment. Though its IB business performance is likely to be weak in the near term, a strong IB pipeline positions the bank to benefit from a recovery in global deal-making activity.However, because of prolonged higher interest rates, BAC’s credit quality has weakened. As it remains vigilant about the effects of continuous high rates, the impact of tariffs on inflation and quantitative tightening on its loan portfolio, its asset quality is expected to remain subdued in the near term.One of the biggest developments for Wells Fargo in recent days has been the lifting of the asset cap imposed in the 2018 consent order by the Federal Reserve. The removal of the growth restriction indicates the substantial progress the bank has made in addressing its deficiencies. Asset cap removal will likely result in a significant improvement in the company’s financial performance and long-term strategic positioning.With this, the company can now boost deposits, grow its loan portfolio and broaden its securities holdings. This will lead to an increase in NII going forward. Moreover, WFC intends to expand fee-generating businesses like payment services, asset management and mortgage origination. These fee income-generating opportunities will bolster its top-line mix.Furthermore, Wells Fargo is adopting a more balanced approach to its operations. While the bank is reducing headcount and streamlining processes, it is investing in its branch network and digital upgrades. This allows the bank to maintain a focus on cost management.Wells Fargo is taking a strategic approach to its branch network, reducing its total branches by 3% year over year to 4,177 in 2024. At the same time, it is focused on modernization, having upgraded 730 branches last year, with plans to revamp the entire network over the next five years. These efficiency efforts are expected to drive $2.4 billion in gross expense reductions in 2025.While 2025 started on a positive note, Trump’s tariff plans and geopolitical tension resulted in massive volatility, upending bullish investor sentiments. This year, shares of Bank of America and Wells Fargo gained 6.6% and 12.5%, respectively. Further, both have outpaced the S&P 500 Index. In terms of investor sentiments, Wells Fargo clearly has the edge.In terms of valuation, BAC is currently trading at a 12-month forward price-to-earnings (P/E) of 11.83X, while the WFC stock is currently trading at a 12-month forward P/E of 12.79X. Further, both are trading at a discount compared with the industry average of 14.21X. So, Bank of America is inexpensive compared to WFC.BAC’s dividend yield of 2.22% is more than Wells Fargo’s 2.02%. Nonetheless, both are higher than the S&P 500 average dividend yield of 1.22%. Bank of America’s return on equity (ROE) of 10.25% is below WFC’s 12.15%. Further, the industry’s ROE is 11.93%. This reflects that WFC is more efficiently using shareholder funds to generate profits. The Zacks Consensus Estimate for BAC’s 2025 and 2026 revenue implies year-over-year growth of 6.1% and 5.8%, respectively. The consensus estimate for earnings indicates a 12.5% and 16.3% rise for 2025 and 2026, respectively. On the contrary, the Zacks Consensus Estimate for WFC’s 2025 and 2026 revenue implies year-over-year growth of just 1.7% and 5.4%, respectively. The consensus estimate for earnings indicates a 9.1% and 14.4% rise for 2025 and 2026, respectively. While both banks present compelling cases, Wells Fargo appears better positioned for near-term upside, thanks to its regained growth flexibility post asset-cap lift, operational streamlining and stronger ROE. Improving investor sentiment and WFC’s solid price performance further strengthen the case. However, for long-term-focused investors, Bank of America’s robust digital strategy, expanding physical footprint and rebound potential in IB may offer superior growth. Nonetheless, its near-term prospects are clouded by asset quality deterioration.Hence, Wells Fargo offers a stronger blend of stability and near-term growth.Currently, BAC and WFC carry a Zacks Rank #3 (Hold). You can see .Want the latest recommendations from Zacks Investment Research? Today, you can download 7 Best Stocks for the Next 30 Days. ","(['Zacks ', ' 8 hours ago'],)","(['BAC ', 'WFC '],)",Bank of America or Wells Fargo: Which Big Bank Offers More Upside?
"Here's a revealing data point: older Americans are scared more of outliving wealth than of death itself.And older Americans have legitimate reasons for this worry, even if they have dutifully saved for their golden years. That's because the traditional ways people manage retirement may no longer provide enough income to meet expenses - and with people generally living longer, the principal retirement savings is exhausted far too early in the retirement period.In the past, investors going into retirement could invest in bonds and count on attractive yields to produce steady, reliable income streams to fund a predictable retirement. 10-year Treasury bond rates in the late 1990s hovered around 6.50%, whereas the current rate is much lower.The impact of this rate decline is sizable: over 20 years, the difference in yield for a $1 million investment in 10-year Treasuries is more than $1 million.In addition to the considerable drop in bond yields, today's retirees are nervous about their future Social Security benefits. Because of certain demographic factors, it's been estimated that the funds that pay the Social Security benefits will run out of money in 2035.How can you avoid dipping into your principal when the investments you counted on in retirement aren't producing income? You can only cut your expenses so far, and the only other option is to find a different investment vehicle to generate income.We feel that these dividend-paying equities - as long as they are from high-quality, low-risk issuers - can give retirement investors a smart option to replace low-yielding Treasury bonds (or other bonds).Look for stocks that have paid steady, increasing dividends for years (or decades), and have not cut their dividends even during recessions.One approach to recognizing appropriate stocks is to look for companies with an average dividend yield of 3% and positive average annual dividend growth. Numerous stocks hike dividends over time, counterbalancing inflation risks.Here are three dividend-paying stocks retirees should consider for their nest egg portfolio.is currently shelling out a dividend of $0.6 per share, with a dividend yield of 8.95%. This compares to the Transportation - Shipping industry's yield of 1.64% and the S&P 500's yield of 1.6%. The company's annualized dividend growth in the past year was 200%. Check Tsakos Energy dividend history here>>>is paying out a dividend of $0.24 per share at the moment, with a dividend yield of 3.31% compared to the Banks - Southeast industry's yield of 2.21% and the S&P 500's yield. The annualized dividend growth of the company was 4.35% over the past year. Check United Community Banks dividend history here>>>Currently paying a dividend of $0.19 per share,has a dividend yield of 4.13%. This is compared to the REIT and Equity Trust - Retail industry's yield of 4.24% and the S&P 500's current yield. Annualized dividend growth for the company in the past year was 11.76%. Check Urban Edge Properties dividend history here>>>The fact is that stocks, as an asset class, carry more risk than bonds. To counterbalance this, invest in superior quality dividend stocks that not only can grow over time but more significantly, can also decrease your overall portfolio volatility with respect to the broader stock market.An advantage of owning dividend stocks for your retirement nest egg is that numerous companies, particularly blue chip stocks, raise their dividends over time, helping alleviate the impact of inflation on your potential retirement income.You may be thinking, ""I like this dividend strategy, but instead of investing in individual stocks, I'm going to find a dividend-focused mutual fund or ETF."" This approach can make sense, but be aware that some mutual funds and specialized ETFs carry high fees, which may reduce your dividend gains or income, and defeat the goal of this dividend investment approach. If you do wish to invest in a fund, do your research to find the best-quality dividend funds with the lowest fees.Whether you select high-quality, low-fee funds or stocks, seeking the steady income of dividend-paying equities can potentially offer you a path to a better and more stress-free retirement.Want the latest recommendations from Zacks Investment Research? Today, you can download 7 Best Stocks for the Next 30 Days. ","(['Zacks ', ' 8 hours ago'],)","(['UCB ', 'UCB-PI '],)",How to Maximize Your Retirement Portfolio with These Top-Ranked Dividend Stocks
" HOOD shares hit an all-time high of $85.55 during Wednesday’s trading session, fueled by investor confidence in the company’s strategic growth initiatives. Strong momentum and increased buying activity helped propel the stock to new heights.This year, HOOD stock has soared 122.1%, massively outperforming the industry’s rally of 14.9%. In contrast, shares of  SCHW gained 21.4%, while  IBKR rose 18.4%.Let’s take a closer look at Robinhood’s fundamentals to assess whether the stock still offers upside or if the rally has already run its course.Robinhood has evolved significantly since the meme stock frenzy of early 2021, emerging as a serious competitor to established online brokerage players like Interactive Brokers and Schwab. The company intends to become a one-stop shop for building generational wealth globally.To align with its goal of becoming an international player, the company has unveiled several products and services, including expanding its advanced desktop platform, Robinhood Legend, to the U.K. following its launch in the United States in October 2024. This aims to attract more sophisticated retail investors.Additionally, in May, HOOD announced an agreement to acquire Canada-based WonderFi Technologies Inc. in a C$250 million all-cash deal. Besides granting regulatory footing in Canada, the transaction strengthens the company’s position in a rapidly growing crypto market. These efforts align with Robinhood’s ambition to become a global player as the company looks to expand its presence beyond the Americas and Europe into the Asia-Pacific region. During its first Investor Day conference in December 2024, CEO Vlad Tenev mentioned that the company will set up a new office in Singapore in 2025, which will serve as HOOD’s headquarters for the region.The company is likely to launch digital asset trading in Singapore soon, having completed the acquisition of Luxembourg-based Bitstamp, a globally recognized cryptocurrency exchange. The deal provides Robinhood with requisite regulatory approvals, positioning the company to enter Singapore’s expanding digital assets market.Robinhood has evolved from a brokerage firm primarily trading in digital assets to a more mature and diversified entity, striving to widen its market and reach. Looking at the numbers, in 2021, it mainly relied on transaction-based revenues (almost 75% of total revenues) to generate income. In 2024, this came down to nearly 56%.Other initiatives by Robinhood reflect its ambition to become a comprehensive financial services provider. In March, the company launched Robinhood Strategies, Robinhood Banking and Robinhood Cortex, a suite of new features, to boost the wealth management offerings for its Robinhood Gold members. Further, it launched the prediction markets hub, allowing customers to trade on the outcomes of several major global events. Initially, the hub will be available across the United States through KalshiEX LLC, a Commodity Futures Trading Commission-regulated exchange.Event contracts gained traction when Robinhood launched them in October 2024, just before the U.S. Presidential elections. Similarly, Interactive Brokers has been actively expanding its event contract offerings to capitalize on rising demand. In April, it launched prediction markets in Canada. Like HOOD, it first introduced event contracts in October 2024, starting with the U.S. election results.Further, in February, Robinhood acquired Gainesville, FL-based TradePMR, a custodial (having $40 billion in assets under administration) and portfolio management platform specializing in services for Registered Investment Advisors. The company gained immediate credibility and resources to cater to wealthier investors seeking advisory solutions. By foraying into the advisory space, the company now directly competes with established players like Schwab and Fidelity Investments.Moreover, in July 2024, Robinhood acquired Pluto Capital Inc. With the integration of Pluto’s advanced capabilities, the company is set to revolutionize the investment experience for its users. Also, as part of a diversification effort, HOOD launched a credit card (expanding in the consumer finance space).Robinhood’s focus on the cryptocurrency space, through increased tokenization, enhanced platform capabilities and expansion into EU markets, is expected to drive greater cost efficiency and revenue growth. The company is actively pursuing Markets in Crypto-Assets Regulation (MiCA) licenses, which would enable it to offer crypto services across the European Economic Area, expanding its reach to 27 countries.The acquisition of Bitstamp and the impending WonderFi deal align with this broader strategy. Bitstamp’s core spot exchange, offering more than 85 tradable assets, will significantly strengthen Robinhood’s crypto product suite. Meanwhile, WonderFi brings two of Canada’s leading regulated crypto platforms — Bitbuy and Coinsquare — with more than C$2.1 billion in assets under custody. These will enable Robinhood to provide trading, staking and custody services.As the platform diversifies and enhances its offerings, Robinhood’s cryptocurrency revenues are well-positioned for growth, supported by increasing investor interest in crypto as both a return-generating and diversification tool. Currently, Robinhood supports many major cryptocurrencies — Bitcoin, Ethereum, Dogecoin, Litecoin, Solana and Toncoin.In 2024, Robinhood announced a share buyback plan (for the first time) to repurchase up to $1 billion of its outstanding common stock. In April, the company increased its existing authorization by $500 million to $1.5 billion. As of April 30, 2025, approximately $833 million worth of shares remained available for repurchase. HOOD plans to complete the remainder of its total authorization over the next roughly two years.Robinhood is on solid ground, with significant cash reserves. As of March 31, 2025, it reported cash and cash equivalents of $4.42 billion.Robinhood operates in a highly regulated industry and is subject to the scrutiny of numerous authorities. This, thus, exposes the company to regulatory risks, resulting in hefty fines and restrictions that may affect its profitability. In March 2025, Robinhood’s units agreed to pay $26 million to settle allegations by the Financial Industry Regulatory Authority for failing to respond to red flags about potential misconduct and not verifying the identities of thousands of customers.In January 2025, the company agreed to pay a $45 million fine for violating more than 10 securities law provisions. In September 2024, the company faced a $3.9 million penalty to settle failures related to crypto withdrawals. In 2023, the company faced defeat in proceedings at the Massachusetts Supreme Judicial Court regarding the supervision of product features and marketing strategies and paid a fine of $7.5 million.These fines have made investors cautious about the company’s operations and internal control procedures.Over the past month, the Zacks Consensus Estimate for 2025 and 2026 has been revised upward to $1.23 and $1.47, respectively. This reflects a bullish sentiment among analysts.The Zacks Consensus Estimate for HOOD’s earnings implies 12.8% and 21.3% year-over-year growth in 2025 and 2026, respectively.Given the impressive price performance, HOOD shares are currently trading at a massive premium to the industry. The company has a forward price-to-earnings (P/E) of 60.98X compared with the industry average of 14.21X.Meanwhile, Schwab and Interactive Brokers have forward P/E ratios of 19.26 and 28.65, respectively. Thus, HOOD is expensive compared with its peers, too.Yet, Robinhood’s global expansion, strategic acquisitions, new product launches and diversification efforts will likely help it grow its market share and presence. Rising investor demand for cryptocurrency and solid liquidity are other positives.Nonetheless, concerns have been raised regarding increased regulatory oversight due to the blurred distinction between gambling and trading in the prediction markets hub. Also, foraying into the banking business amid intense competition keeps investors cautious about its success. Uncertainties related to tariffs pose a near-term risk. Hence, investors must keep an eye on macro developments and other headwinds and see how Robinhood is navigating the challenging times. Thus, the stock is a cautious bet for long-term investors, but they should be prepared for short-term volatility.At present, Robinhood carries a Zacks Rank #3 (Hold). You can see .Want the latest recommendations from Zacks Investment Research? Today, you can download 7 Best Stocks for the Next 30 Days. ","(['Zacks ', ' 8 hours ago'],)","(['HOOD ', 'IBKR '],)",Robinhood Hits All-Time High: Is it Too Late to Buy HOOD Stock?
